number,value,params_C,params_balanceado,params_conjunto,params_l1_ratio,modelo,params_l2_regularization,params_learning_rate,params_max_depth,params_max_iter,params_max_leaf_nodes,params_min_samples_leaf,mejor_hasta_ahora
24,0.08374030169900175,1.9862952382497652,False,,,Logística híbrida (señales de D2 + variables académicas),,,,,,,0.08771867744957287
25,0.08732369130909723,4.391464882368209,True,,,Logística híbrida (señales de D2 + variables académicas),,,,,,,0.08771867744957287
26,0.08771867744957287,8.721322493445495,True,,,Logística híbrida (señales de D2 + variables académicas),,,,,,,0.08771867744957287
27,0.08716886092005556,1.707205115760111,True,,,Logística híbrida (señales de D2 + variables académicas),,,,,,,0.08771867744957287
28,0.08374873406403638,2.923363409121317,False,,,Logística híbrida (señales de D2 + variables académicas),,,,,,,0.08771867744957287
29,0.08677987064518215,0.8996537606443413,True,,,Logística híbrida (señales de D2 + variables académicas),,,,,,,0.08771867744957287
30,0.08360949138405814,1.0554119660074013,False,,,Logística híbrida (señales de D2 + variables académicas),,,,,,,0.08771867744957287
31,0.08750236736632397,7.639832324409774,True,,,Logística híbrida (señales de D2 + variables académicas),,,,,,,0.08771867744957287
32,0.08771589419145458,9.845772241610662,True,,,Logística híbrida (señales de D2 + variables académicas),,,,,,,0.08771867744957287
33,0.08734396295971142,4.473092521995605,True,,,Logística híbrida (señales de D2 + variables académicas),,,,,,,0.08771867744957287
34,0.08622186544638424,0.0019278996876195362,True,,,Logística híbrida (señales de D2 + variables académicas),,,,,,,0.08771867744957287
35,0.08771589419145458,9.70469045303592,True,,,Logística híbrida (señales de D2 + variables académicas),,,,,,,0.08771867744957287
36,0.08726445879138214,3.9494555417452064,True,,,Logística híbrida (señales de D2 + variables académicas),,,,,,,0.08771867744957287
37,0.08376967133776071,3.995362383159555,False,,,Logística híbrida (señales de D2 + variables académicas),,,,,,,0.08771867744957287
38,0.0875077652615152,5.011733638773677,True,,,Logística híbrida (señales de D2 + variables académicas),,,,,,,0.08771867744957287
39,0.08722360272975835,2.5319619734613927,True,,,Logística híbrida (señales de D2 + variables académicas),,,,,,,0.08771867744957287
40,0.08356382625620573,0.47161402462735186,False,,,Logística híbrida (señales de D2 + variables académicas),,,,,,,0.08771867744957287
41,0.08387309407479655,9.512372304286894,False,,,Logística híbrida (señales de D2 + variables académicas),,,,,,,0.08771867744957287
42,0.08771867744957287,8.427186749139551,True,,,Logística híbrida (señales de D2 + variables académicas),,,,,,,0.08771867744957287
43,0.08749943982912703,7.358407029351667,True,,,Logística híbrida (señales de D2 + variables académicas),,,,,,,0.08771867744957287
44,0.08750343020520246,5.845504695256915,True,,,Logística híbrida (señales de D2 + variables académicas),,,,,,,0.08771867744957287
45,0.08690291536102551,1.2893133271258663,True,,,Logística híbrida (señales de D2 + variables académicas),,,,,,,0.08771867744957287
46,0.08725520159082631,3.3604899881879855,True,,,Logística híbrida (señales de D2 + variables académicas),,,,,,,0.08771867744957287
47,0.08771589419145458,9.575614158240304,True,,,Logística híbrida (señales de D2 + variables académicas),,,,,,,0.08771867744957287
48,0.08721063955677588,2.072564115331776,True,,,Logística híbrida (señales de D2 + variables académicas),,,,,,,0.08771867744957287
49,0.08751089757948519,6.694356776587935,True,,,Logística híbrida (señales de D2 + variables académicas),,,,,,,0.08771867744957287
50,0.08581840235043392,0.14821551825903573,True,,,Logística híbrida (señales de D2 + variables académicas),,,,,,,0.08771867744957287
51,0.08771867744957287,8.705702694066703,True,,,Logística híbrida (señales de D2 + variables académicas),,,,,,,0.08771867744957287
52,0.08385081295628624,5.302072643222281,False,,,Logística híbrida (señales de D2 + variables académicas),,,,,,,0.08771867744957287
53,0.08749774874740593,5.748095987044841,True,,,Logística híbrida (señales de D2 + variables académicas),,,,,,,0.08771867744957287
54,0.08723745491515623,3.1725413504961315,True,,,Logística híbrida (señales de D2 + variables académicas),,,,,,,0.08771867744957287
55,0.08771824459814209,9.9563449873191,True,,,Logística híbrida (señales de D2 + variables académicas),,,,,,,0.08771867744957287
56,0.08749774874740593,5.624728827766492,True,,,Logística híbrida (señales de D2 + variables académicas),,,,,,,0.08771867744957287
57,0.08597866537063886,0.005015799436471371,False,,,Logística híbrida (señales de D2 + variables académicas),,,,,,,0.08771867744957287
58,0.08721287617653486,2.362008819126404,True,,,Logística híbrida (señales de D2 + variables académicas),,,,,,,0.08771867744957287
59,0.0872560588783559,3.3119556207020473,True,,,Logística híbrida (señales de D2 + variables académicas),,,,,,,0.08771867744957287
