number,value,params_C,params_balanceado,params_conjunto,params_l1_ratio,modelo,params_l2_regularization,params_learning_rate,params_max_depth,params_max_iter,params_max_leaf_nodes,params_min_samples_leaf,mejor_hasta_ahora
0,0.08794614886472966,0.004207988669606638,True,reducido,0.15599452033620265,Regresión logística regularizada,,,,,,,0.08794614886472966
1,0.06206896551724138,0.0012087541473056963,False,reducido,0.9699098521619943,Regresión logística regularizada,,,,,,,0.08794614886472966
2,0.06206896551724138,0.016480446427978974,False,completo,0.5247564316322378,Regresión logística regularizada,,,,,,,0.08794614886472966
3,0.09047401743834826,0.01474275315991467,True,completo,0.3663618432936917,Regresión logística regularizada,,,,,,,0.09047401743834826
4,0.09728001319727989,0.23423849847112907,False,reducido,0.046450412719997725,Regresión logística regularizada,,,,,,,0.09728001319727989
5,0.10538793365480162,7.2866537374910445,False,completo,0.8083973481164611,Regresión logística regularizada,,,,,,,0.10538793365480162
6,0.06206896551724138,0.003077180271250686,True,completo,0.4951769101112702,Regresión logística regularizada,,,,,,,0.10538793365480162
7,0.06990308110933555,0.017654048052495083,False,reducido,0.5200680211778108,Regresión logística regularizada,,,,,,,0.10538793365480162
8,0.09475387196948173,5.727904470799623,True,completo,0.8948273504276488,Regresión logística regularizada,,,,,,,0.10538793365480162
9,0.06206896551724138,0.0015167330688076208,False,reducido,0.32533033076326434,Regresión logística regularizada,,,,,,,0.10538793365480162
10,0.09555068799842892,1.6994548387478847,False,completo,0.43039404889349603,Regresión logística regularizada,,,,,,,0.10538793365480162
11,0.10186753203609059,3.3276019553072835,False,reducido,0.09953748025899001,Regresión logística regularizada,,,,,,,0.10538793365480162
12,0.10023771793184205,2.0692686395335285,False,reducido,0.7840160166706074,Regresión logística regularizada,,,,,,,0.10538793365480162
13,0.10141231000562138,9.558262316701743,False,completo,0.019533542848836793,Regresión logística regularizada,,,,,,,0.10538793365480162
14,0.10157038914929943,2.5999340315451422,False,completo,0.21152701087608905,Regresión logística regularizada,,,,,,,0.10538793365480162
15,0.09895849134737719,0.5716899730642496,False,completo,0.9692668339157138,Regresión logística regularizada,,,,,,,0.10538793365480162
16,0.10124253229791641,7.468166712474943,False,completo,0.7180286199281569,Regresión logística regularizada,,,,,,,0.10538793365480162
17,0.09976674537144681,0.7617837294342571,False,reducido,0.34898359891433106,Regresión logística regularizada,,,,,,,0.10538793365480162
18,0.10153063335779054,7.689606921733119,False,reducido,0.31345624025052954,Regresión logística regularizada,,,,,,,0.10538793365480162
19,0.09622930055029151,0.3280414336787335,True,reducido,0.7419690008225377,Regresión logística regularizada,,,,,,,0.10538793365480162
20,0.09247311057018259,0.2591082954039938,False,completo,0.6935340163239077,Regresión logística regularizada,,,,,,,0.10538793365480162
21,0.10153108843280781,2.7055770820165153,False,completo,0.1987024434752801,Regresión logística regularizada,,,,,,,0.10538793365480162
22,0.09422286709825853,0.38624945692476853,False,completo,0.15225395703429967,Regresión logística regularizada,,,,,,,0.10538793365480162
23,0.10549190720463958,3.6610831538446655,False,completo,0.9419916391753032,Regresión logística regularizada,,,,,,,0.10549190720463958
24,0.10232787966334794,1.7589096772465396,False,completo,0.8793292962425956,Regresión logística regularizada,,,,,,,0.10549190720463958
25,0.10233884151939768,2.1213556392285278,False,completo,0.9326299619213361,Regresión logística regularizada,,,,,,,0.10549190720463958
26,0.10162156202759978,6.381195483774531,False,reducido,0.9134475885099187,Regresión logística regularizada,,,,,,,0.10549190720463958
27,0.105483672333704,8.847708850433216,False,completo,0.8266326799654933,Regresión logística regularizada,,,,,,,0.10549190720463958
28,0.10550507361635852,9.879316739710076,False,completo,0.8507616449017837,Regresión logística regularizada,,,,,,,0.10550507361635852
29,0.10125942919529865,0.6226890628530323,False,completo,0.7483838859696882,Regresión logística regularizada,,,,,,,0.10550507361635852
30,0.10129298435458188,7.414432617152621,False,completo,0.5562361461794489,Regresión logística regularizada,,,,,,,0.10550507361635852
31,0.09477609609335623,4.0011601182548935,True,completo,0.7602255688545294,Regresión logística regularizada,,,,,,,0.10550507361635852
32,0.10536975257417636,8.124187446190517,False,completo,0.8390091772526233,Regresión logística regularizada,,,,,,,0.10550507361635852
33,0.10178797361124409,2.2979906187752785,False,completo,0.7394256340363711,Regresión logística regularizada,,,,,,,0.10550507361635852
34,0.10154687976953221,2.4622578847948113,False,completo,0.6240370374353412,Regresión logística regularizada,,,,,,,0.10550507361635852
35,0.10547615230573629,4.287641963889507,False,completo,0.8851587929659714,Regresión logística regularizada,,,,,,,0.10550507361635852
36,0.09344680187776142,1.1868270901311941,True,completo,0.6783495036142102,Regresión logística regularizada,,,,,,,0.10550507361635852
37,0.0867931738740607,0.06205954752630164,False,completo,0.8858779444866229,Regresión logística regularizada,,,,,,,0.10550507361635852
38,0.10543474478632323,4.409821613451134,False,completo,0.9221888880812303,Regresión logística regularizada,,,,,,,0.10550507361635852
39,0.10132160075426949,3.5822041675322462,False,completo,0.8079841283334193,Regresión logística regularizada,,,,,,,0.10550507361635852
40,0.10556108760084182,5.998793606362716,False,completo,0.9960779131610917,Regresión logística regularizada,,,,,,,0.10556108760084182
41,0.1018689182799585,5.400830113162366,False,reducido,0.7991306080586874,Regresión logística regularizada,,,,,,,0.10556108760084182
42,0.10557172205692608,5.877877601818082,False,completo,0.9872689724843998,Regresión logística regularizada,,,,,,,0.10557172205692608
43,0.10550261772211174,9.736430345033911,False,completo,0.9985290798325372,Regresión logística regularizada,,,,,,,0.10557172205692608
44,0.10545579050218515,8.694716713289768,False,completo,0.9235503131858357,Regresión logística regularizada,,,,,,,0.10557172205692608
45,0.1053999891164518,4.425792881457656,False,completo,0.9947537913746388,Regresión logística regularizada,,,,,,,0.10557172205692608
46,0.10133577804439864,0.6570077601180034,False,completo,0.8254946086775696,Regresión logística regularizada,,,,,,,0.10557172205692608
47,0.10155409453622474,4.540124545959404,False,completo,0.6393951778959384,Regresión logística regularizada,,,,,,,0.10557172205692608
48,0.10535355214298846,7.772437012903045,False,completo,0.9810075319913366,Regresión logística regularizada,,,,,,,0.10557172205692608
49,0.09477916282768321,2.1945237321670064,True,completo,0.8448469578123566,Regresión logística regularizada,,,,,,,0.10557172205692608
50,0.0948331279490423,2.8357369357213984,True,completo,0.9790867093364023,Regresión logística regularizada,,,,,,,0.10557172205692608
51,0.10113205990788435,2.2274111732349344,False,reducido,0.9561296832881523,Regresión logística regularizada,,,,,,,0.10557172205692608
52,0.10565283184508212,2.745026856683684,False,completo,0.8669904130070579,Regresión logística regularizada,,,,,,,0.10565283184508212
53,0.10539306670165971,6.385650496721464,False,completo,0.7715527474701648,Regresión logística regularizada,,,,,,,0.10565283184508212
54,0.10155469161981585,9.677584314913563,False,reducido,0.9691536149312004,Regresión logística regularizada,,,,,,,0.10565283184508212
55,0.10250580635139257,1.396786992285248,False,completo,0.7901628051925159,Regresión logística regularizada,,,,,,,0.10565283184508212
56,0.0995146893818754,1.2099919461625346,False,reducido,0.8976855705490775,Regresión logística regularizada,,,,,,,0.10565283184508212
57,0.10214522170972276,3.0274453419747758,False,reducido,0.8735251179844309,Regresión logística regularizada,,,,,,,0.10565283184508212
58,0.10069311889650912,1.065569735502087,False,completo,0.8682139399718204,Regresión logística regularizada,,,,,,,0.10565283184508212
59,0.1015863758842375,0.6895306717846443,False,completo,0.9215520968105246,Regresión logística regularizada,,,,,,,0.10565283184508212
0,0.0797678690909161,,True,reducido,,"Gradient boosting (árboles, monotonía en atrasos)",0.2537815508265665,0.015958237752949748,2.0,298.0,4.0,107.0,0.0797678690909161
1,0.07659620407242065,,True,reducido,,"Gradient boosting (árboles, monotonía en atrasos)",0.05342937261279776,0.017240892195821537,2.0,152.0,7.0,73.0,0.0797678690909161
2,0.07265368591181305,,False,completo,,"Gradient boosting (árboles, monotonía en atrasos)",0.23423849847112907,0.03920673972242137,4.0,66.0,6.0,71.0,0.0797678690909161
3,0.06716372814541262,,False,completo,,"Gradient boosting (árboles, monotonía en atrasos)",0.5456725485601477,0.18043311207136256,4.0,204.0,7.0,29.0,0.0797678690909161
4,0.06734722609988508,,False,reducido,,"Gradient boosting (árboles, monotonía en atrasos)",0.1537592023548176,0.02171103454376615,3.0,114.0,7.0,72.0,0.0797678690909161
5,0.07503314182670989,,True,completo,,"Gradient boosting (árboles, monotonía en atrasos)",0.0015167330688076208,0.059963338824126605,4.0,164.0,5.0,39.0,0.0797678690909161
6,0.08402608658172514,,True,completo,,"Gradient boosting (árboles, monotonía en atrasos)",0.0019870215385428634,0.023200867504756827,3.0,396.0,5.0,101.0,0.08402608658172514
7,0.07221777677260695,,False,completo,,"Gradient boosting (árboles, monotonía en atrasos)",0.02715581955282941,0.08310795711416077,4.0,90.0,13.0,27.0,0.08402608658172514
8,0.07952802530124314,,True,completo,,"Gradient boosting (árboles, monotonía en atrasos)",3.53875886477924,0.02538617845650057,2.0,215.0,12.0,84.0,0.08402608658172514
9,0.07561296047486729,,True,reducido,,"Gradient boosting (árboles, monotonía en atrasos)",0.0012637946338082875,0.10070509112900147,3.0,87.0,10.0,63.0,0.08402608658172514
10,0.07456701168749488,,True,completo,,"Gradient boosting (árboles, monotonía en atrasos)",0.01362100470455074,0.012427915265120505,3.0,328.0,5.0,21.0,0.08402608658172514
11,0.07638969531743248,,True,reducido,,"Gradient boosting (árboles, monotonía en atrasos)",0.1593915817593937,0.016799337348737054,2.0,348.0,6.0,95.0,0.08402608658172514
12,0.07870644098201879,,True,reducido,,"Gradient boosting (árboles, monotonía en atrasos)",4.1551218718362835,0.03613523644921963,3.0,279.0,4.0,96.0,0.08402608658172514
13,0.0843519174988972,,True,completo,,"Gradient boosting (árboles, monotonía en atrasos)",0.0031322284553251425,0.06358525782834044,4.0,349.0,6.0,102.0,0.0843519174988972
14,0.08448780141766904,,True,completo,,"Gradient boosting (árboles, monotonía en atrasos)",0.0011889870817598706,0.05511184277316218,3.0,381.0,8.0,103.0,0.08448780141766904
15,0.08523932199242759,,True,completo,,"Gradient boosting (árboles, monotonía en atrasos)",0.0401655425865987,0.04003353383926343,4.0,319.0,5.0,120.0,0.08523932199242759
16,0.08602160701601738,,True,completo,,"Gradient boosting (árboles, monotonía en atrasos)",1.3080574034121066,0.05992899802060902,3.0,363.0,8.0,110.0,0.08602160701601738
17,0.08382121666113315,,True,completo,,"Gradient boosting (árboles, monotonía en atrasos)",0.030239111839454585,0.053612853416860326,3.0,290.0,8.0,89.0,0.08602160701601738
18,0.08661444987011074,,True,completo,,"Gradient boosting (árboles, monotonía en atrasos)",2.187296768904288,0.05089119051015718,4.0,399.0,7.0,113.0,0.08661444987011074
19,0.08412435920600211,,True,completo,,"Gradient boosting (árboles, monotonía en atrasos)",1.3558662554515495,0.07577980590696705,3.0,344.0,8.0,102.0,0.08661444987011074
20,0.0822786519052899,,True,completo,,"Gradient boosting (árboles, monotonía en atrasos)",1.6807234597449132,0.0898681601984649,4.0,374.0,9.0,107.0,0.08661444987011074
21,0.08516620084940799,,True,completo,,"Gradient boosting (árboles, monotonía en atrasos)",8.364204415462444,0.05001977933577718,4.0,365.0,6.0,114.0,0.08661444987011074
22,0.08548013830423504,,True,completo,,"Gradient boosting (árboles, monotonía en atrasos)",0.025334366148463763,0.027840831610030436,4.0,273.0,5.0,119.0,0.08661444987011074
23,0.08455958890029189,,True,completo,,"Gradient boosting (árboles, monotonía en atrasos)",0.21009701531128303,0.04158080509573174,3.0,381.0,5.0,95.0,0.08661444987011074
24,0.0860466667794426,,True,completo,,"Gradient boosting (árboles, monotonía en atrasos)",0.0078068422654517695,0.03420813033715664,4.0,208.0,7.0,110.0,0.08661444987011074
25,0.08123487553915884,,True,completo,,"Gradient boosting (árboles, monotonía en atrasos)",3.7418462822991962,0.027874672268507174,3.0,391.0,8.0,118.0,0.08661444987011074
26,0.07446527530926286,,True,completo,,"Gradient boosting (árboles, monotonía en atrasos)",0.22636903042996767,0.041674889380799066,4.0,389.0,7.0,76.0,0.08661444987011074
27,0.08460540222681759,,True,completo,,"Gradient boosting (árboles, monotonía en atrasos)",4.697147402102789,0.0876471166308527,3.0,383.0,4.0,92.0,0.08661444987011074
28,0.08940398763502484,,True,completo,,"Gradient boosting (árboles, monotonía en atrasos)",4.249411419942127,0.03509858574254279,3.0,359.0,6.0,101.0,0.08940398763502484
29,0.08447131998847605,,True,completo,,"Gradient boosting (árboles, monotonía en atrasos)",0.27429942612722197,0.02278145352887135,4.0,341.0,8.0,112.0,0.08940398763502484
30,0.08938098797338528,,True,completo,,"Gradient boosting (árboles, monotonía en atrasos)",4.5001173131037655,0.04549459010330012,4.0,244.0,6.0,111.0,0.08940398763502484
31,0.08732826271509805,,True,completo,,"Gradient boosting (árboles, monotonía en atrasos)",8.723994864039472,0.05375432345938456,4.0,252.0,6.0,108.0,0.08940398763502484
32,0.08537354954547041,,True,completo,,"Gradient boosting (árboles, monotonía en atrasos)",3.3976378460247325,0.043832242840868785,4.0,241.0,5.0,115.0,0.08940398763502484
33,0.08337482240252231,,True,completo,,"Gradient boosting (árboles, monotonía en atrasos)",3.8808816663351533,0.0872458412945252,4.0,259.0,7.0,104.0,0.08940398763502484
34,0.08436350390828111,,True,completo,,"Gradient boosting (árboles, monotonía en atrasos)",7.457995079219958,0.022370692286704266,4.0,324.0,6.0,105.0,0.08940398763502484
35,0.0821691794271992,,True,completo,,"Gradient boosting (árboles, monotonía en atrasos)",7.709518825628294,0.04621369221122889,4.0,400.0,4.0,97.0,0.08940398763502484
36,0.08416494772400379,,True,completo,,"Gradient boosting (árboles, monotonía en atrasos)",3.8367149820948327,0.055538120100686386,4.0,267.0,6.0,100.0,0.08940398763502484
37,0.0883241574301776,,True,completo,,"Gradient boosting (árboles, monotonía en atrasos)",9.017893099995064,0.03712056312614543,4.0,244.0,6.0,89.0,0.08940398763502484
38,0.08239830378732504,,True,completo,,"Gradient boosting (árboles, monotonía en atrasos)",8.732686376123496,0.028736751243967504,4.0,149.0,5.0,95.0,0.08940398763502484
39,0.08495187080691072,,True,completo,,"Gradient boosting (árboles, monotonía en atrasos)",1.2380941752424066,0.051379665187208864,4.0,370.0,6.0,100.0,0.08940398763502484
40,0.08840358757840758,,True,completo,,"Gradient boosting (árboles, monotonía en atrasos)",1.53218007006162,0.0666305802907855,4.0,285.0,5.0,108.0,0.08940398763502484
41,0.08257693893850727,,True,completo,,"Gradient boosting (árboles, monotonía en atrasos)",3.338363246704839,0.030907576405369223,4.0,241.0,6.0,104.0,0.08940398763502484
42,0.08376373020003598,,True,completo,,"Gradient boosting (árboles, monotonía en atrasos)",1.9855319039031225,0.08613796551576502,4.0,290.0,7.0,117.0,0.08940398763502484
43,0.07750358245240627,,True,completo,,"Gradient boosting (árboles, monotonía en atrasos)",9.079998907960844,0.042113088716009876,4.0,189.0,4.0,118.0,0.08940398763502484
44,0.07907714625524682,,True,completo,,"Gradient boosting (árboles, monotonía en atrasos)",2.462304509047238,0.043256769479236075,4.0,257.0,4.0,100.0,0.08940398763502484
45,0.0845065515290172,,True,completo,,"Gradient boosting (árboles, monotonía en atrasos)",1.1566036531195092,0.05687273296801948,4.0,229.0,8.0,108.0,0.08940398763502484
46,0.08235820996341198,,True,completo,,"Gradient boosting (árboles, monotonía en atrasos)",5.844679500251483,0.03892137250912504,4.0,173.0,7.0,94.0,0.08940398763502484
47,0.08519612605033061,,True,completo,,"Gradient boosting (árboles, monotonía en atrasos)",2.4949490377733703,0.049916034302716385,4.0,185.0,6.0,107.0,0.08940398763502484
48,0.08786322796832928,,True,completo,,"Gradient boosting (árboles, monotonía en atrasos)",0.7802711076293671,0.05558939638090893,4.0,246.0,5.0,106.0,0.08940398763502484
49,0.0702767469329742,,True,completo,,"Gradient boosting (árboles, monotonía en atrasos)",5.3594115677933996,0.030554885847401136,4.0,206.0,5.0,78.0,0.08940398763502484
50,0.08395400995263488,,True,completo,,"Gradient boosting (árboles, monotonía en atrasos)",6.619340221476445,0.05018510637085946,4.0,275.0,6.0,84.0,0.08940398763502484
51,0.08771657868972509,,True,completo,,"Gradient boosting (árboles, monotonía en atrasos)",1.0565129447654042,0.057015166465426134,4.0,320.0,6.0,114.0,0.08940398763502484
52,0.0856308632235957,,True,completo,,"Gradient boosting (árboles, monotonía en atrasos)",1.150939750976416,0.04551922242990707,4.0,322.0,6.0,104.0,0.08940398763502484
53,0.08714973586145813,,True,completo,,"Gradient boosting (árboles, monotonía en atrasos)",0.7570587393545429,0.06425421020803808,4.0,311.0,6.0,117.0,0.08940398763502484
54,0.07280688693974066,,True,completo,,"Gradient boosting (árboles, monotonía en atrasos)",6.655175692561188,0.04459835056930334,4.0,222.0,6.0,81.0,0.08940398763502484
55,0.08062091639747979,,True,completo,,"Gradient boosting (árboles, monotonía en atrasos)",1.2517992420956512,0.049497333547156665,4.0,282.0,4.0,119.0,0.08940398763502484
56,0.08659625890859966,,True,completo,,"Gradient boosting (árboles, monotonía en atrasos)",1.692190763619551,0.08885902240150782,4.0,252.0,4.0,109.0,0.08940398763502484
57,0.08790662008572822,,True,completo,,"Gradient boosting (árboles, monotonía en atrasos)",1.6929059509417927,0.041492871331903824,4.0,284.0,5.0,107.0,0.08940398763502484
58,0.08696288099662225,,True,completo,,"Gradient boosting (árboles, monotonía en atrasos)",9.403108056221374,0.043854371111946094,4.0,311.0,5.0,108.0,0.08940398763502484
59,0.0824537639798386,,True,completo,,"Gradient boosting (árboles, monotonía en atrasos)",8.241126818694491,0.026518638367188496,4.0,239.0,6.0,86.0,0.08940398763502484
0,0.0834933936638407,0.8471801418819978,False,,,Logística híbrida (señales de D2 + variables académicas),,,,,,,0.0834933936638407
1,0.08611246789665387,0.004207053950287938,True,,,Logística híbrida (señales de D2 + variables académicas),,,,,,,0.08611246789665387
2,0.08384813073949637,0.2537815508265665,False,,,Logística híbrida (señales de D2 + variables académicas),,,,,,,0.08611246789665387
3,0.08750236736632397,7.579479953348009,True,,,Logística híbrida (señales de D2 + variables académicas),,,,,,,0.08750236736632397
4,0.08618455975647986,0.005337032762603957,True,,,Logística híbrida (señales de D2 + variables académicas),,,,,,,0.08750236736632397
5,0.08393372108031368,0.12561043700013558,False,,,Logística híbrida (señales de D2 + variables académicas),,,,,,,0.08750236736632397
6,0.08639364020885859,0.2801635158716261,True,,,Logística híbrida (señales de D2 + variables académicas),,,,,,,0.08750236736632397
7,0.08532039096214838,0.029204338471814112,False,,,Logística híbrida (señales de D2 + variables académicas),,,,,,,0.08750236736632397
8,0.08583372742131606,0.006290644294586149,False,,,Logística híbrida (señales de D2 + variables académicas),,,,,,,0.08750236736632397
9,0.08712207954452297,0.0015339162591163618,False,,,Logística híbrida (señales de D2 + variables académicas),,,,,,,0.08750236736632397
10,0.08771867744957287,9.013186751477164,True,,,Logística híbrida (señales de D2 + variables académicas),,,,,,,0.08771867744957287
11,0.08750781261034532,6.432763348748267,True,,,Logística híbrida (señales de D2 + variables académicas),,,,,,,0.08771867744957287
12,0.08749943982912703,7.423271397759785,True,,,Logística híbrida (señales de D2 + variables académicas),,,,,,,0.08771867744957287
13,0.08697613154958025,1.5493870214134116,True,,,Logística híbrida (señales de D2 + variables académicas),,,,,,,0.08771867744957287
14,0.08699989563052936,1.599050406373122,True,,,Logística híbrida (señales de D2 + variables académicas),,,,,,,0.08771867744957287
15,0.08380126741356961,7.1452517770242805,False,,,Logística híbrida (señales de D2 + variables académicas),,,,,,,0.08771867744957287
16,0.08721953434572507,2.429626051031983,True,,,Logística híbrida (señales de D2 + variables académicas),,,,,,,0.08771867744957287
17,0.08577656950169404,0.038507133029914924,True,,,Logística híbrida (señales de D2 + variables académicas),,,,,,,0.08771867744957287
18,0.0867725562910558,0.6420543487708539,True,,,Logística híbrida (señales de D2 + variables académicas),,,,,,,0.08771867744957287
19,0.0872301213672831,2.8505130548675646,True,,,Logística híbrida (señales de D2 + variables académicas),,,,,,,0.08771867744957287
20,0.08677670075286696,0.5939823763055851,True,,,Logística híbrida (señales de D2 + variables académicas),,,,,,,0.08771867744957287
21,0.08771589419145458,9.691982048060956,True,,,Logística híbrida (señales de D2 + variables académicas),,,,,,,0.08771867744957287
22,0.08729863841212507,4.02832000384389,True,,,Logística híbrida (señales de D2 + variables académicas),,,,,,,0.08771867744957287
23,0.08771867744957287,8.900522443988311,True,,,Logística híbrida (señales de D2 + variables académicas),,,,,,,0.08771867744957287
