number,value,params_C,params_balanceado,params_conjunto,params_l1_ratio,modelo,params_l2_regularization,params_learning_rate,params_max_depth,params_max_iter,params_max_leaf_nodes,params_min_samples_leaf,mejor_hasta_ahora
0,0.13064290217287136,0.004207988669606638,True,reducido,0.15599452033620265,Regresión logística regularizada,,,,,,,0.13064290217287136
1,0.07333908541846419,0.0012087541473056963,False,reducido,0.9699098521619943,Regresión logística regularizada,,,,,,,0.13064290217287136
2,0.13355921492623601,0.016480446427978974,False,completo,0.5247564316322378,Regresión logística regularizada,,,,,,,0.13355921492623601
3,0.13199652844318022,0.01474275315991467,True,completo,0.3663618432936917,Regresión logística regularizada,,,,,,,0.13355921492623601
4,0.11759186837410093,0.23423849847112907,False,reducido,0.046450412719997725,Regresión logística regularizada,,,,,,,0.13355921492623601
5,0.11171199031439052,7.2866537374910445,False,completo,0.8083973481164611,Regresión logística regularizada,,,,,,,0.13355921492623601
6,0.11348931688537123,0.003077180271250686,True,completo,0.4951769101112702,Regresión logística regularizada,,,,,,,0.13355921492623601
7,0.13405896187451385,0.017654048052495083,False,reducido,0.5200680211778108,Regresión logística regularizada,,,,,,,0.13405896187451385
8,0.10618655528022222,5.727904470799623,True,completo,0.8948273504276488,Regresión logística regularizada,,,,,,,0.13405896187451385
9,0.07333908541846419,0.0015167330688076208,False,reducido,0.32533033076326434,Regresión logística regularizada,,,,,,,0.13405896187451385
10,0.12058700968591547,0.43488136048639386,False,reducido,0.8493636080882521,Regresión logística regularizada,,,,,,,0.13405896187451385
11,0.13109617438122,0.05488674896332177,False,reducido,0.5229651939422192,Regresión logística regularizada,,,,,,,0.13405896187451385
12,0.13083950951324705,0.053836722008373236,False,completo,0.603382524825246,Regresión logística regularizada,,,,,,,0.13405896187451385
13,0.07333908541846419,0.002105201779827037,False,completo,0.8034877763794668,Regresión logística regularizada,,,,,,,0.13405896187451385
14,0.13076473831590663,0.01365957274012712,False,reducido,0.26220469210632374,Regresión logística regularizada,,,,,,,0.13405896187451385
15,0.1126000957406186,2.0288373741385297,False,completo,0.5101128195400922,Regresión logística regularizada,,,,,,,0.13405896187451385
16,0.07333908541846419,0.0012031776023023783,False,completo,0.15603057216419336,Regresión logística regularizada,,,,,,,0.13405896187451385
17,0.11348931688537123,0.007215962686636069,False,reducido,0.6677804129844171,Regresión logística regularizada,,,,,,,0.13405896187451385
18,0.1308290820357956,0.08456974929785385,False,completo,0.9503125929041454,Regresión logística regularizada,,,,,,,0.13405896187451385
19,0.12090968979991965,0.2731326113604805,False,reducido,0.5978493436613357,Regresión logística regularizada,,,,,,,0.13405896187451385
20,0.11348931688537123,0.009245341824694154,False,completo,0.42269913109354423,Regresión logística regularizada,,,,,,,0.13405896187451385
21,0.12635884150674428,0.02352960130621858,True,reducido,0.45410210657824646,Regresión logística regularizada,,,,,,,0.13405896187451385
22,0.11811487632360805,0.18294515088058025,False,completo,0.2792650938914535,Regresión logística regularizada,,,,,,,0.13405896187451385
23,0.11519286350476962,0.08212394109525087,True,completo,0.4232392492921345,Regresión logística regularizada,,,,,,,0.13405896187451385
24,0.11171804119561157,0.07045151788122145,True,completo,0.11265724134711991,Regresión logística regularizada,,,,,,,0.13405896187451385
25,0.13405896187451385,0.003567109185192344,True,completo,0.2888774295974464,Regresión logística regularizada,,,,,,,0.13405896187451385
26,0.13245028384021118,0.0027336452142589906,True,completo,0.27717164419824775,Regresión logística regularizada,,,,,,,0.13405896187451385
27,0.12426906507307385,0.011600320775777885,True,completo,0.1493873757552327,Regresión logística regularizada,,,,,,,0.13405896187451385
28,0.07333908541846419,0.0015301079608839514,False,reducido,0.5930375274647421,Regresión logística regularizada,,,,,,,0.13405896187451385
29,0.07333908541846419,0.0012057955876795749,True,completo,0.4240577555717989,Regresión logística regularizada,,,,,,,0.13405896187451385
30,0.12375305039817186,0.00596591330749518,True,completo,0.060412948518965864,Regresión logística regularizada,,,,,,,0.13405896187451385
31,0.1313993985662212,0.0053061360703349604,True,completo,0.23106925117211102,Regresión logística regularizada,,,,,,,0.13405896187451385
32,0.11348931688537123,0.0012651962680489972,True,completo,0.3036865542562281,Regresión logística regularizada,,,,,,,0.13405896187451385
33,0.1303064966352909,0.013703174821532245,True,completo,0.6801081032015465,Regresión logística regularizada,,,,,,,0.13405896187451385
34,0.13010611925659468,0.04348336678023436,False,completo,0.3719024988075172,Regresión logística regularizada,,,,,,,0.13405896187451385
35,0.1315123317754345,0.00232357504159684,True,completo,0.10091973289510639,Regresión logística regularizada,,,,,,,0.13405896187451385
36,0.07333908541846419,0.0022912162939643407,False,completo,0.38185826249411936,Regresión logística regularizada,,,,,,,0.13405896187451385
37,0.12222566901832088,0.15345024713732902,False,reducido,0.4749656570402403,Regresión logística regularizada,,,,,,,0.13405896187451385
38,0.07333908541846419,0.004663996412021035,False,reducido,0.46244859934166527,Regresión logística regularizada,,,,,,,0.13405896187451385
39,0.11348931688537123,0.010855129972014084,False,completo,0.5937301016249048,Regresión logística regularizada,,,,,,,0.13405896187451385
40,0.1322905031564304,0.0055336288646920685,True,completo,0.5794109377379824,Regresión logística regularizada,,,,,,,0.13405896187451385
41,0.07333908541846419,0.0013705645054553908,True,completo,0.5372705801096325,Regresión logística regularizada,,,,,,,0.13405896187451385
42,0.11348931688537123,0.005703967095911171,True,completo,0.8613288582217196,Regresión logística regularizada,,,,,,,0.13405896187451385
43,0.11348931688537123,0.0047010965022378825,True,completo,0.6996223943901247,Regresión logística regularizada,,,,,,,0.13405896187451385
44,0.12607935708926732,0.037321597371444595,True,completo,0.6937626718725619,Regresión logística regularizada,,,,,,,0.13405896187451385
45,0.13431646764592398,0.022427829352589978,False,reducido,0.649212066743145,Regresión logística regularizada,,,,,,,0.13431646764592398
46,0.13491906246642554,0.024189481491873988,False,reducido,0.6094520625358265,Regresión logística regularizada,,,,,,,0.13491906246642554
47,0.1322905031564304,0.0194434959907917,False,reducido,0.7277343400833318,Regresión logística regularizada,,,,,,,0.13491906246642554
48,0.13064449092899583,0.0573371743535137,False,reducido,0.7274114958114127,Regresión logística regularizada,,,,,,,0.13491906246642554
49,0.13024979157105593,0.018613517907486693,False,reducido,0.40573197761917257,Regresión logística regularizada,,,,,,,0.13491906246642554
50,0.12597835223750786,0.10862371552798149,False,reducido,0.6645797534096607,Regresión logística regularizada,,,,,,,0.13491906246642554
51,0.07333908541846419,0.0057376363676442,False,reducido,0.56186973883329,Regresión logística regularizada,,,,,,,0.13491906246642554
52,0.1335416158436331,0.0030175304947218217,True,completo,0.2707515583502337,Regresión logística regularizada,,,,,,,0.13491906246642554
53,0.13380471975681785,0.010723838831520713,False,completo,0.3245531141446948,Regresión logística regularizada,,,,,,,0.13491906246642554
54,0.13486603372767325,0.022474703328886656,False,completo,0.5723333742057398,Regresión logística regularizada,,,,,,,0.13491906246642554
55,0.13114371167077224,0.013492861142702945,True,reducido,0.6068085273961077,Regresión logística regularizada,,,,,,,0.13491906246642554
56,0.11348931688537123,0.0073777176209756275,False,reducido,0.3601312583146961,Regresión logística regularizada,,,,,,,0.13491906246642554
57,0.07333908541846419,0.004003986196817615,False,reducido,0.7044523723093592,Regresión logística regularizada,,,,,,,0.13491906246642554
58,0.13118098057434646,0.02605529702256424,False,completo,0.48157585229046573,Regresión logística regularizada,,,,,,,0.13491906246642554
59,0.11348931688537123,0.009450587098006849,False,reducido,0.5121659215758043,Regresión logística regularizada,,,,,,,0.13491906246642554
0,0.11998920550766448,,True,reducido,,"Gradient boosting (árboles, monotonía en atrasos)",0.2537815508265665,0.015958237752949748,2.0,298.0,4.0,107.0,0.11998920550766448
1,0.12316045190373587,,True,reducido,,"Gradient boosting (árboles, monotonía en atrasos)",0.05342937261279776,0.017240892195821537,2.0,152.0,7.0,73.0,0.12316045190373587
2,0.11205917354536449,,False,completo,,"Gradient boosting (árboles, monotonía en atrasos)",0.23423849847112907,0.03920673972242137,4.0,66.0,6.0,71.0,0.12316045190373587
3,0.11300635265582408,,False,completo,,"Gradient boosting (árboles, monotonía en atrasos)",0.5456725485601477,0.18043311207136256,4.0,204.0,7.0,29.0,0.12316045190373587
4,0.11289086544119248,,False,reducido,,"Gradient boosting (árboles, monotonía en atrasos)",0.1537592023548176,0.02171103454376615,3.0,114.0,7.0,72.0,0.12316045190373587
5,0.11442668094073244,,True,completo,,"Gradient boosting (árboles, monotonía en atrasos)",0.0015167330688076208,0.059963338824126605,4.0,164.0,5.0,39.0,0.12316045190373587
6,0.11387190572067918,,True,completo,,"Gradient boosting (árboles, monotonía en atrasos)",0.0019870215385428634,0.023200867504756827,3.0,396.0,5.0,101.0,0.12316045190373587
7,0.10770637451154623,,False,completo,,"Gradient boosting (árboles, monotonía en atrasos)",0.02715581955282941,0.08310795711416077,4.0,90.0,13.0,27.0,0.12316045190373587
8,0.11511524411838191,,True,completo,,"Gradient boosting (árboles, monotonía en atrasos)",3.53875886477924,0.02538617845650057,2.0,215.0,12.0,84.0,0.12316045190373587
9,0.11332375646843196,,True,reducido,,"Gradient boosting (árboles, monotonía en atrasos)",0.0012637946338082875,0.10070509112900147,3.0,87.0,10.0,63.0,0.12316045190373587
10,0.11735014225771115,,True,reducido,,"Gradient boosting (árboles, monotonía en atrasos)",0.13495792928109046,0.016429765692409205,2.0,327.0,6.0,46.0,0.12316045190373587
11,0.11896825753026152,,True,reducido,,"Gradient boosting (árboles, monotonía en atrasos)",0.06927908325618223,0.032270680084804534,2.0,241.0,7.0,95.0,0.12316045190373587
12,0.11971556715105389,,True,reducido,,"Gradient boosting (árboles, monotonía en atrasos)",3.0941371204768853,0.03613523644921963,3.0,259.0,4.0,90.0,0.12316045190373587
13,0.1214438624610049,,True,reducido,,"Gradient boosting (árboles, monotonía en atrasos)",0.18078323623811662,0.01056399193889249,2.0,136.0,9.0,108.0,0.12316045190373587
14,0.12242362018461114,,True,reducido,,"Gradient boosting (árboles, monotonía en atrasos)",0.02768172135778286,0.018394907979015353,2.0,93.0,9.0,87.0,0.12316045190373587
15,0.11902577108430695,,True,reducido,,"Gradient boosting (árboles, monotonía en atrasos)",0.06469422535224753,0.03551625858601155,2.0,112.0,11.0,83.0,0.12316045190373587
16,0.12206437940008004,,True,reducido,,"Gradient boosting (árboles, monotonía en atrasos)",0.012745927602127642,0.02217743742739607,2.0,79.0,4.0,69.0,0.12316045190373587
17,0.11946510809171149,,True,reducido,,"Gradient boosting (árboles, monotonía en atrasos)",0.009854918236030748,0.021236097667505307,2.0,69.0,8.0,47.0,0.12316045190373587
18,0.11225528329423404,,True,reducido,,"Gradient boosting (árboles, monotonía en atrasos)",0.005237690285993534,0.02551012091287325,3.0,162.0,11.0,92.0,0.12316045190373587
19,0.12018683035527725,,True,reducido,,"Gradient boosting (árboles, monotonía en atrasos)",0.0013485277208796357,0.02321903670042139,2.0,182.0,10.0,63.0,0.12316045190373587
20,0.1226509478886928,,True,reducido,,"Gradient boosting (árboles, monotonía en atrasos)",0.592026244499812,0.01469080032716475,2.0,121.0,9.0,77.0,0.12316045190373587
21,0.12005090798527959,,True,reducido,,"Gradient boosting (árboles, monotonía en atrasos)",7.054515554766522,0.01776823087398986,2.0,152.0,8.0,93.0,0.12316045190373587
22,0.12215349273391728,,True,reducido,,"Gradient boosting (árboles, monotonía en atrasos)",0.03221296889057651,0.010356801848025813,2.0,143.0,9.0,69.0,0.12316045190373587
23,0.12085762115351652,,True,reducido,,"Gradient boosting (árboles, monotonía en atrasos)",0.7933483084779088,0.015501094044548476,2.0,169.0,9.0,64.0,0.12316045190373587
24,0.1148178877394258,,True,reducido,,"Gradient boosting (árboles, monotonía en atrasos)",0.1315447973809666,0.013588034530297655,3.0,127.0,10.0,74.0,0.12316045190373587
25,0.12279411643059997,,True,reducido,,"Gradient boosting (árboles, monotonía en atrasos)",0.9841017665894247,0.021768956201286542,2.0,143.0,6.0,71.0,0.12316045190373587
26,0.12272539921202053,,True,reducido,,"Gradient boosting (árboles, monotonía en atrasos)",1.0519694481268,0.010777624934505285,2.0,146.0,6.0,82.0,0.12316045190373587
27,0.12174437392365976,,True,reducido,,"Gradient boosting (árboles, monotonía en atrasos)",0.034221666237030386,0.016310513489129787,2.0,134.0,5.0,81.0,0.12316045190373587
28,0.12172479494824266,,True,reducido,,"Gradient boosting (árboles, monotonía en atrasos)",2.7053960814437223,0.016980082175726587,2.0,160.0,5.0,67.0,0.12316045190373587
29,0.11942106814094647,,True,reducido,,"Gradient boosting (árboles, monotonía en atrasos)",0.36026936855657654,0.016080343298316552,2.0,180.0,6.0,86.0,0.12316045190373587
30,0.1224974267077841,,True,reducido,,"Gradient boosting (árboles, monotonía en atrasos)",6.630140227420469,0.013245590571221568,2.0,88.0,5.0,84.0,0.12316045190373587
31,0.12158915678536517,,True,reducido,,"Gradient boosting (árboles, monotonía en atrasos)",0.5819377154677774,0.02191839531866802,2.0,113.0,6.0,66.0,0.12316045190373587
32,0.11985774066431333,,True,reducido,,"Gradient boosting (árboles, monotonía en atrasos)",0.928231466317176,0.012755337003682357,2.0,147.0,5.0,98.0,0.12316045190373587
33,0.1190058305069622,,True,reducido,,"Gradient boosting (árboles, monotonía en atrasos)",0.9618244031270279,0.03078200406062381,2.0,116.0,8.0,52.0,0.12316045190373587
34,0.12137662613149965,,True,reducido,,"Gradient boosting (árboles, monotonía en atrasos)",3.7624684610798185,0.010281674316274985,2.0,200.0,6.0,85.0,0.12316045190373587
35,0.12040791237782728,,True,reducido,,"Gradient boosting (árboles, monotonía en atrasos)",1.4102696799472445,0.014187306324435286,2.0,159.0,9.0,84.0,0.12316045190373587
36,0.12059464001151264,,True,reducido,,"Gradient boosting (árboles, monotonía en atrasos)",1.532795703033218,0.027354968613595935,2.0,169.0,6.0,65.0,0.12316045190373587
37,0.12109638363438424,,True,reducido,,"Gradient boosting (árboles, monotonía en atrasos)",0.7567931762922048,0.010569029246237809,2.0,155.0,8.0,101.0,0.12316045190373587
38,0.12138576057314297,,True,reducido,,"Gradient boosting (árboles, monotonía en atrasos)",0.255837569471366,0.011975989850964345,2.0,116.0,9.0,82.0,0.12316045190373587
39,0.12156098023969679,,True,reducido,,"Gradient boosting (árboles, monotonía en atrasos)",0.017006655507921197,0.018191106911842305,2.0,134.0,7.0,66.0,0.12316045190373587
40,0.12381287959527523,,True,reducido,,"Gradient boosting (árboles, monotonía en atrasos)",0.6266278604818301,0.010635886986298975,2.0,108.0,8.0,69.0,0.12381287959527523
41,0.11596839311368062,,True,reducido,,"Gradient boosting (árboles, monotonía en atrasos)",0.12552072027504407,0.01336439600381853,2.0,71.0,8.0,68.0,0.12381287959527523
42,0.11759012605414638,,True,reducido,,"Gradient boosting (árboles, monotonía en atrasos)",5.227547928785699,0.01430298074995532,2.0,59.0,7.0,78.0,0.12381287959527523
43,0.1215401190541434,,True,reducido,,"Gradient boosting (árboles, monotonía en atrasos)",0.3933303641781213,0.010467356100410025,2.0,179.0,5.0,60.0,0.12381287959527523
44,0.12154247887444622,,True,reducido,,"Gradient boosting (árboles, monotonía en atrasos)",0.31929122087068623,0.013092107036291645,2.0,136.0,9.0,59.0,0.12381287959527523
45,0.12250461730246906,,True,reducido,,"Gradient boosting (árboles, monotonía en atrasos)",1.1467428083999893,0.01230776449054405,2.0,183.0,6.0,74.0,0.12381287959527523
46,0.12440390559169245,,True,reducido,,"Gradient boosting (árboles, monotonía en atrasos)",0.8182066624970435,0.014782622652172438,2.0,77.0,6.0,66.0,0.12440390559169245
47,0.11920553223935741,,True,reducido,,"Gradient boosting (árboles, monotonía en atrasos)",1.4401388711390146,0.012348529579735897,2.0,52.0,5.0,54.0,0.12440390559169245
48,0.1245490276217881,,True,reducido,,"Gradient boosting (árboles, monotonía en atrasos)",0.4421440909177542,0.014119654253052415,2.0,79.0,6.0,67.0,0.1245490276217881
49,0.11876993098175531,,True,reducido,,"Gradient boosting (árboles, monotonía en atrasos)",1.0049150263635975,0.01216544859399105,2.0,84.0,7.0,58.0,0.1245490276217881
50,0.12368403751912475,,True,reducido,,"Gradient boosting (árboles, monotonía en atrasos)",0.4789395579060735,0.010491961659112044,2.0,113.0,6.0,69.0,0.1245490276217881
51,0.12308497104069205,,True,reducido,,"Gradient boosting (árboles, monotonía en atrasos)",0.21604956321143237,0.01356166424151213,2.0,115.0,6.0,79.0,0.1245490276217881
52,0.11613799267941419,,True,reducido,,"Gradient boosting (árboles, monotonía en atrasos)",0.15608120679140844,0.010324279783262127,2.0,70.0,6.0,66.0,0.1245490276217881
53,0.12415607439578666,,True,reducido,,"Gradient boosting (árboles, monotonía en atrasos)",0.20034071376435422,0.010261257402088237,2.0,114.0,7.0,66.0,0.1245490276217881
54,0.12421456055771637,,True,reducido,,"Gradient boosting (árboles, monotonía en atrasos)",0.7099924799120564,0.01627978953923672,2.0,84.0,6.0,59.0,0.1245490276217881
55,0.12482008352709478,,True,reducido,,"Gradient boosting (árboles, monotonía en atrasos)",1.9392422417274633,0.015777232078560362,2.0,72.0,7.0,59.0,0.12482008352709478
56,0.11602898116680083,,True,reducido,,"Gradient boosting (árboles, monotonía en atrasos)",1.812379652689685,0.014891851127166933,2.0,65.0,7.0,68.0,0.12482008352709478
57,0.12229522815353187,,True,reducido,,"Gradient boosting (árboles, monotonía en atrasos)",0.3871655285703972,0.014664242098240568,2.0,126.0,5.0,66.0,0.12482008352709478
58,0.12165882257585897,,True,reducido,,"Gradient boosting (árboles, monotonía en atrasos)",1.4588308931833593,0.014479008874272168,2.0,107.0,6.0,50.0,0.12482008352709478
59,0.12133485343951764,,True,reducido,,"Gradient boosting (árboles, monotonía en atrasos)",0.28373689314821515,0.015573024788819638,2.0,99.0,6.0,52.0,0.12482008352709478
0,0.11024217649778469,0.8471801418819978,False,,,Logística híbrida (señales de D2 + variables académicas),,,,,,,0.11024217649778469
1,0.1138132276195555,0.004207053950287938,True,,,Logística híbrida (señales de D2 + variables académicas),,,,,,,0.1138132276195555
2,0.11050978692034759,0.2537815508265665,False,,,Logística híbrida (señales de D2 + variables académicas),,,,,,,0.1138132276195555
3,0.10857804381948988,7.579479953348009,True,,,Logística híbrida (señales de D2 + variables académicas),,,,,,,0.1138132276195555
4,0.11164229119930631,0.005337032762603957,True,,,Logística híbrida (señales de D2 + variables académicas),,,,,,,0.1138132276195555
5,0.110909567840381,0.12561043700013558,False,,,Logística híbrida (señales de D2 + variables académicas),,,,,,,0.1138132276195555
6,0.10883054383024249,0.2801635158716261,True,,,Logística híbrida (señales de D2 + variables académicas),,,,,,,0.1138132276195555
7,0.11096730955693257,0.029204338471814112,False,,,Logística híbrida (señales de D2 + variables académicas),,,,,,,0.1138132276195555
8,0.11305192882505662,0.006290644294586149,False,,,Logística híbrida (señales de D2 + variables académicas),,,,,,,0.1138132276195555
9,0.11172645523711848,0.0015339162591163618,False,,,Logística híbrida (señales de D2 + variables académicas),,,,,,,0.1138132276195555
10,0.10926867173247726,0.03730532151193006,True,,,Logística híbrida (señales de D2 + variables académicas),,,,,,,0.1138132276195555
11,0.11261970273694201,0.0017783818507637848,True,,,Logística híbrida (señales de D2 + variables académicas),,,,,,,0.1138132276195555
12,0.11251484022416705,0.005574774751658903,False,,,Logística híbrida (señales de D2 + variables académicas),,,,,,,0.1138132276195555
13,0.11370554795544868,0.011752248587179681,False,,,Logística híbrida (señales de D2 + variables académicas),,,,,,,0.1138132276195555
14,0.11056867335439642,0.018170723604970112,True,,,Logística híbrida (señales de D2 + variables académicas),,,,,,,0.1138132276195555
15,0.11277936585882703,0.0015591703078346264,True,,,Logística híbrida (señales de D2 + variables académicas),,,,,,,0.1138132276195555
16,0.11007137308528632,7.7509717211263,False,,,Logística híbrida (señales de D2 + variables académicas),,,,,,,0.1138132276195555
17,0.11334497811824734,0.012166121924006054,False,,,Logística híbrida (señales de D2 + variables académicas),,,,,,,0.1138132276195555
18,0.11062092479811914,0.00729274834500395,True,,,Logística híbrida (señales de D2 + variables académicas),,,,,,,0.1138132276195555
19,0.11024224742992272,0.05975683887697561,True,,,Logística híbrida (señales de D2 + variables académicas),,,,,,,0.1138132276195555
20,0.11067914222383826,0.05540894236555173,False,,,Logística híbrida (señales de D2 + variables académicas),,,,,,,0.1138132276195555
21,0.11146415180543057,0.015029547634660164,False,,,Logística híbrida (señales de D2 + variables académicas),,,,,,,0.1138132276195555
22,0.11338432509345374,0.013737311213390835,False,,,Logística híbrida (señales de D2 + variables académicas),,,,,,,0.1138132276195555
23,0.11136280547508269,0.002985340826528182,False,,,Logística híbrida (señales de D2 + variables académicas),,,,,,,0.1138132276195555
