number,value,params_C,params_balanceado,params_conjunto,params_l1_ratio,modelo,params_l2_regularization,params_learning_rate,params_max_depth,params_max_iter,params_max_leaf_nodes,params_min_samples_leaf,mejor_hasta_ahora
24,0.11123891307278316,0.0024961372629635167,False,,,Logística híbrida (señales de D2 + variables académicas),,,,,,,0.1138132276195555
25,0.11360484687929776,0.004257213625052485,True,,,Logística híbrida (señales de D2 + variables académicas),,,,,,,0.1138132276195555
26,0.11168057012398243,0.005488384042498817,True,,,Logística híbrida (señales de D2 + variables académicas),,,,,,,0.1138132276195555
27,0.11363795557435624,0.0036248951012320656,True,,,Logística híbrida (señales de D2 + variables académicas),,,,,,,0.1138132276195555
28,0.1110239541982737,0.010653287874041724,True,,,Logística híbrida (señales de D2 + variables académicas),,,,,,,0.1138132276195555
29,0.11125357198264924,0.0010511026778643932,True,,,Logística híbrida (señales de D2 + variables académicas),,,,,,,0.1138132276195555
30,0.11028496261324108,0.01982385908295525,True,,,Logística híbrida (señales de D2 + variables académicas),,,,,,,0.1138132276195555
31,0.11319225127022434,0.00286809738217661,True,,,Logística híbrida (señales de D2 + variables académicas),,,,,,,0.1138132276195555
32,0.10995938307117031,1.8753167605882108,False,,,Logística híbrida (señales de D2 + variables académicas),,,,,,,0.1138132276195555
33,0.11330699598029685,0.0032567037011242235,True,,,Logística híbrida (señales de D2 + variables académicas),,,,,,,0.1138132276195555
34,0.1110726064766153,0.010329289240061445,True,,,Logística híbrida (señales de D2 + variables académicas),,,,,,,0.1138132276195555
35,0.11303275522867154,0.0026624386824920417,True,,,Logística híbrida (señales de D2 + variables académicas),,,,,,,0.1138132276195555
36,0.11366780363513651,0.0037457748322034233,True,,,Logística híbrida (señales de D2 + variables académicas),,,,,,,0.1138132276195555
37,0.11062891254110427,0.1695500218980053,False,,,Logística híbrida (señales de D2 + variables académicas),,,,,,,0.1138132276195555
38,0.10864419883517773,2.8458239360392876,True,,,Logística híbrida (señales de D2 + variables académicas),,,,,,,0.1138132276195555
39,0.11106905936811948,0.025947625167630682,False,,,Logística híbrida (señales de D2 + variables académicas),,,,,,,0.1138132276195555
40,0.11697018538116953,0.0011634015110971118,False,,,Logística híbrida (señales de D2 + variables académicas),,,,,,,0.11697018538116953
41,0.11682074783330562,0.0010139760343997766,False,,,Logística híbrida (señales de D2 + variables académicas),,,,,,,0.11697018538116953
42,0.11133601901450951,0.002088757482019636,False,,,Logística híbrida (señales de D2 + variables académicas),,,,,,,0.11697018538116953
43,0.11717081751398786,0.0014211124398530515,False,,,Logística híbrida (señales de D2 + variables académicas),,,,,,,0.11717081751398786
44,0.1168535139418141,0.0010351957345222094,False,,,Logística híbrida (señales de D2 + variables académicas),,,,,,,0.11717081751398786
45,0.1168898537891855,0.0012481138122163585,False,,,Logística híbrida (señales de D2 + variables académicas),,,,,,,0.11717081751398786
46,0.11689877412462266,0.0010834591965766314,False,,,Logística híbrida (señales de D2 + variables académicas),,,,,,,0.11717081751398786
47,0.11197977090446869,0.0016433572518764537,False,,,Logística híbrida (señales de D2 + variables académicas),,,,,,,0.11717081751398786
48,0.11234622492525148,0.004852621683423712,False,,,Logística híbrida (señales de D2 + variables académicas),,,,,,,0.11717081751398786
49,0.11724902891598046,0.001389252736388575,False,,,Logística híbrida (señales de D2 + variables académicas),,,,,,,0.11724902891598046
50,0.11199514564023899,0.0037841586696319976,False,,,Logística híbrida (señales de D2 + variables académicas),,,,,,,0.11724902891598046
51,0.11687605678884942,0.0011063154228197418,False,,,Logística híbrida (señales de D2 + variables académicas),,,,,,,0.11724902891598046
52,0.11171467570473606,0.0015743048528265688,False,,,Logística híbrida (señales de D2 + variables académicas),,,,,,,0.11724902891598046
53,0.11178276074250043,0.001697498734829207,False,,,Logística híbrida (señales de D2 + variables académicas),,,,,,,0.11724902891598046
54,0.11143672483069288,0.0031674918320344094,False,,,Logística híbrida (señales de D2 + variables académicas),,,,,,,0.11724902891598046
55,0.11292562537855148,0.0077302723079260135,False,,,Logística híbrida (señales de D2 + variables académicas),,,,,,,0.11724902891598046
56,0.11676411627550493,0.0013391576241629007,False,,,Logística híbrida (señales de D2 + variables académicas),,,,,,,0.11724902891598046
57,0.11122192188477212,0.0025079650028518733,False,,,Logística híbrida (señales de D2 + variables académicas),,,,,,,0.11724902891598046
58,0.11301258245560615,0.006881487734591261,False,,,Logística híbrida (señales de D2 + variables académicas),,,,,,,0.11724902891598046
59,0.11690839122428899,0.0012593265371475314,False,,,Logística híbrida (señales de D2 + variables académicas),,,,,,,0.11724902891598046
